Word;Example Sentence (Danish);Meaning;Example Translation (English);Forms
forlystelse;Biografen er en populær forlystelse for unge;entertainment amusement;The cinema is a popular form of entertainment for young people;en forlystelse forlystelsen forlystelser forlystelserne
forsømme;Han forsømte sine lektier i sidste uge;to neglect;He neglected his homework last week;at forsømme forsømmer forsømte har forsømt
samle;Vi skal samle pengene til turen;to collect gather;We have to collect the money for the trip;at samle samler samlede har samlet
foretrække;Jeg foretrækker te frem for kaffe;to prefer;I prefer tea to coffee;at foretrække foretrækker foretrak har foretrukket
hellere;Jeg vil hellere blive hjemme i dag;rather would rather;I would rather stay at home today;adverb no inflection
derfor;Det regnede meget derfor blev vi hjemme;therefore that is why;It rained a lot therefore we stayed at home;adverb no inflection
formel;Det er en formel e mail til skolen;formal;It is a formal email to the school;formel formelt formelle